<?xml version="1.0" encoding="UTF-8"?>
<!DOCTYPE directory SYSTEM "directory.dtd">
<directory>
  <person anrede="Frau">
    <vorname>Erika</vorname>
    <nachname>Wanner</nachname>
  </person>
  <person anrede="Frau">
    <vorname>Daniela</vorname>
    <nachname>Frischknecht</nachname>
  </person>
  <person anrede="Herr">
    <vorname>Klaus</vorname>
    <nachname>Leuenberger</nachname>
  </person>
</directory>
